{"$schema":"https://json-schema.org/draft/2020-12/schema","additionalProperties":false,"properties":{"contract":{"type":"string"},"expected_canonical_sha256":{"pattern":"^[0-9a-f]{64}$","type":"string"},"expected_lock":{"type":"object"},"input":{"type":"object"},"name":{"type":"string"},"output":{"type":"object"}},"required":["name","contract","input","output","expected_lock","expected_canonical_sha256"],"title":"Canopy Node Contract conformance fixture v1alpha1","type":"object"}
